{
  "$schema": "https://json-schema.org/draft/2020-12/schema",
  "title": "UID_AUTH Manifest Schema",
  "description": "Schema du manifeste UID_AUTH pour l'identification, la preuve d'origine, l'integrite et les signaux IA/TDM.",
  "type": "object",

  "properties": {

    "uid_auth": {
      "type": "string",
      "pattern": "^[A-Z]{2}-[0-9]{4}-AUTH-[A-Z]{3}-[0-9]{6}$",
      "description": "Identifiant souverain UID_AUTH (ex: FR-2025-AUTH-MUS-000001)."
    },

    "spec_version": {
      "type": "string",
      "const": "1.0",
      "description": "Version du standard UID_AUTH."
    },

    "media_type": {
      "type": "string",
      "description": "Type media de l'oeuvre, par exemple audio/wav, image/png, video/mp4 ou text/plain."
    },

    "name": {
      "type": "string",
      "description": "Nom de l'oeuvre."
    },

    "creator": {
      "type": "string",
      "description": "Nom public, pseudonyme, identifiant institutionnel ou valeur neutre. Ce champ est optionnel pour respecter la minimisation RGPD."
    },

    "origin": {
      "type": "string",
      "enum": ["human", "ai", "hybrid"],
      "description": "Declaration d'origine de l'oeuvre."
    },

    "issued_at": {
      "type": "string",
      "format": "date-time",
      "description": "Horodatage ISO 8601 indiquant la date de generation de l'UID_AUTH."
    },

    "issuer": {
      "type": "object",
      "description": "Autorite ayant delivre l'UID_AUTH.",
      "properties": {
        "name": {
          "type": "string",
          "description": "Nom public, pseudonyme ou identifiant institutionnel de l'autorite emettrice."
        },
        "type": {
          "type": "string",
          "enum": ["IdentityAuthority", "CollectingSociety", "Label", "TrustedEntity"],
          "description": "Typologie de l'autorite emettrice."
        }
      },
      "required": ["name", "type"]
    },

    "rights": {
      "type": "object",
      "description": "Bloc decrivant les droits et restrictions lies a l'oeuvre, notamment IA/TDM.",
      "properties": {

        "ai_training": {
          "type": "string",
          "enum": ["prohibited", "allowed", "restricted", "conditional"],
          "description": "Statut de l'oeuvre pour l'entrainement IA."
        },

        "training_conditions": {
          "type": "string",
          "format": "uri",
          "description": "URL vers les conditions detaillees."
        },

        "tdm_opt_out": {
          "type": "boolean",
          "description": "Activation du droit d'opposition au Text and Data Mining."
        },

        "jurisdiction": {
          "type": "string",
          "description": "Juridiction applicable (ex : 'EU', 'FR', 'US')."
        }
      },
      "required": ["ai_training"]
    },

    "hash": {
      "type": "object",
      "description": "Preuve d'integrite cryptographique.",
      "properties": {
        "algorithm": {
          "type": "string",
          "enum": ["sha256"],
          "description": "Algorithme utilise pour le hash."
        },
        "value": {
          "type": "string",
          "pattern": "^[a-fA-F0-9]{64}$",
          "description": "Valeur hexadecimale du hash SHA-256."
        }
      },
      "required": ["algorithm", "value"]
    }
  },

  "required": [
    "uid_auth",
    "spec_version",
    "origin",
    "issued_at",
    "issuer",
    "rights",
    "hash"
  ]
}
